<?xml version="1.0" encoding="ISO-8859-1" ?>
<!DOCTYPE program [
<!ATTLIST program
   name CDATA #IMPLIED>
<!ELEMENT program (cfg*)>
<!ATTLIST cfg
  id ID #REQUIRED
  main CDATA #IMPLIED
  name CDATA #IMPLIED>
<!ELEMENT cfg (bb+)>
<!ATTLIST bb
   id ID #REQUIRED>
<!ELEMENT bb (prec?,inst*,succ?)>
<!ELEMENT prec (link+)>
<!ELEMENT succ (link+)>
<!ATTLIST link
  type (taken|nottaken|call) #REQUIRED
  cfg CDATA #REQUIRED
  bb IDREF #REQUIRED>
<!ELEMENT link EMPTY>
<!ATTLIST inst
   addr CDATA #REQUIRED
   instr CDATA #IMPLIED>
<!ELEMENT inst EMPTY>
]>
<program name="bubblesort">
  <cfg id="9" name="main">
    <bb id="153">
      <inst addr="0x8768" instr="stmdb sp!, {r3, r4, r5, r6, r7, r8, r9, lr}"/>
      <inst addr="0x876c" instr="subs r4, r0, #1"/>
      <inst addr="0x876e" instr="add r7, sp, #0"/>
      <inst addr="0x8770" instr="lsls r3, r4, #2"/>
      <inst addr="0x8772" instr="adds r3, #14"/>
      <inst addr="0x8774" instr="cmp r0, #1"/>
      <inst addr="0x8776" instr="bic.w r3, r3, #7"/>
      <inst addr="0x877a" instr="sub.w sp, sp, r3"/>
      <inst addr="0x877e" instr="mov r9, sp"/>
      <inst addr="0x8780" instr="beq.n 87a8 main+0x40"/>
      <succ>
        <link type="taken" cfg="9" bb="160"/>
        <link type="nottaken" cfg="9" bb="154"/>
      </succ>
    </bb>
    <bb id="154">
      <inst addr="0x8782" instr="cmp r4, #0"/>
      <inst addr="0x8784" instr="ble.n 879e main+0x36"/>
      <succ>
        <link type="taken" cfg="9" bb="158"/>
        <link type="nottaken" cfg="9" bb="155"/>
      </succ>
    </bb>
    <bb id="155">
      <inst addr="0x8786" instr="movs r5, #0"/>
      <inst addr="0x8788" instr="mov r8, r1"/>
      <inst addr="0x878a" instr="mov r6, sp"/>
      <succ>
        <link type="nottaken" cfg="9" bb="156"/>
      </succ>
    </bb>
    <bb id="156">
      <inst addr="0x878c" instr="ldr.w r0, [r8, #4]!"/>
      <inst addr="0x8790" instr="adds r5, #1"/>
      <inst addr="0x8792" instr="bl 8e60 atoi"/>
      <succ>
        <link type="nottaken" cfg="9" bb="157"/>
        <link type="call" cfg="28" bb="267"/>
      </succ>
    </bb>
    <bb id="157">
      <inst addr="0x8796" instr="cmp r4, r5"/>
      <inst addr="0x8798" instr="str.w r0, [r6], #4"/>
      <inst addr="0x879c" instr="bgt.n 878c main+0x24"/>
      <succ>
        <link type="taken" cfg="9" bb="156"/>
        <link type="nottaken" cfg="9" bb="158"/>
      </succ>
    </bb>
    <bb id="158">
      <inst addr="0x879e" instr="mov r0, r4"/>
      <inst addr="0x87a0" instr="mov r1, r9"/>
      <inst addr="0x87a2" instr="bl 8854 bubblesort"/>
      <succ>
        <link type="nottaken" cfg="9" bb="159"/>
        <link type="call" cfg="14" bb="167"/>
      </succ>
    </bb>
    <bb id="159">
      <inst addr="0x87a6" instr="movs r0, #0"/>
      <succ>
        <link type="nottaken" cfg="9" bb="160"/>
      </succ>
    </bb>
    <bb id="160">
      <inst addr="0x87a8" instr="mov sp, r7"/>
      <inst addr="0x87aa" instr="ldmia.w sp!, {r3, r4, r5, r6, r7, r8, r9, pc}"/>
      <inst addr="0x87ae" instr="nop"/>
      <succ>
      </succ>
    </bb>
  </cfg>
  <cfg id="14" name="bubblesort">
    <bb id="167">
      <inst addr="0x8854" instr="subs r0, #1"/>
      <inst addr="0x8856" instr="cmp r0, #0"/>
      <inst addr="0x8858" instr="push {r4, r5}"/>
      <inst addr="0x885a" instr="ble.n 887e bubblesort+0x2a"/>
      <succ>
        <link type="taken" cfg="14" bb="171"/>
        <link type="nottaken" cfg="14" bb="168"/>
      </succ>
    </bb>
    <bb id="168">
      <inst addr="0x885c" instr="movs r2, #0"/>
      <inst addr="0x885e" instr="cmp r0, #0"/>
      <inst addr="0x8860" instr="mov r3, r1"/>
      <inst addr="0x8862" instr="ble.n 887a bubblesort+0x26"/>
      <succ>
        <link type="taken" cfg="14" bb="170"/>
        <link type="nottaken" cfg="14" bb="169"/>
      </succ>
    </bb>
    <bb id="169">
      <inst addr="0x8864" instr="ldr r5, [r3, #4]"/>
      <inst addr="0x8866" instr="adds r2, #1"/>
      <inst addr="0x8868" instr="ldr.w r4, [r3], #4"/>
      <inst addr="0x886c" instr="cmp r5, r4"/>
      <inst addr="0x886e" instr="itt lt"/>
      <inst addr="0x8870" instr="strlt.w r5, [r3, #-4]"/>
      <inst addr="0x8874" instr="strlt r4, [r3, #0]"/>
      <inst addr="0x8876" instr="cmp r2, r0"/>
      <inst addr="0x8878" instr="bne.n 8864 bubblesort+0x10"/>
      <succ>
        <link type="taken" cfg="14" bb="169"/>
        <link type="nottaken" cfg="14" bb="170"/>
      </succ>
    </bb>
    <bb id="170">
      <inst addr="0x887a" instr="subs r0, #1"/>
      <inst addr="0x887c" instr="bne.n 885c bubblesort+0x8"/>
      <succ>
        <link type="taken" cfg="14" bb="168"/>
        <link type="nottaken" cfg="14" bb="171"/>
      </succ>
    </bb>
    <bb id="171">
      <inst addr="0x887e" instr="pop {r4, r5}"/>
      <inst addr="0x8880" instr="bx lr"/>
      <inst addr="0x8882" instr="nop"/>
      <succ>
      </succ>
    </bb>
  </cfg>
  <cfg id="26" name="__errno_location">
    <bb id="264">
      <inst addr="0x8e30" instr="ldr r3, [pc, #12] ; (8e40 __errno_location+0x10)"/>
      <inst addr="0x8e32" instr="mrc 15, 0, r0, cr13, cr0, {3}"/>
      <inst addr="0x8e36" instr="add r3, pc"/>
      <inst addr="0x8e38" instr="ldr r3, [r3, #0]"/>
      <inst addr="0x8e3a" instr="adds r0, r0, r3"/>
      <inst addr="0x8e3c" instr="bx lr"/>
      <inst addr="0x8e3e" instr="nop"/>
      <inst addr="0x8e40" instr=".word 0x0005ddf6"/>
      <succ>
      </succ>
    </bb>
  </cfg>
  <cfg id="28" name="atoi">
    <bb id="267">
      <inst addr="0x8e60" instr="movs r1, #0"/>
      <inst addr="0x8e62" instr="movs r2, #10"/>
      <inst addr="0x8e64" instr="b.w 9200 strtol"/>
      <succ>
        <link type="call" cfg="36" bb="371"/>
      </succ>
    </bb>
  </cfg>
  <cfg id="36" name="strtol">
    <bb id="371">
      <inst addr="0x9200" instr="push {r4, r5, lr}"/>
      <inst addr="0x9202" instr="mrc 15, 0, r5, cr13, cr0, {3}"/>
      <inst addr="0x9206" instr="ldr r4, [pc, #20] ; (921c strtol+0x1c)"/>
      <inst addr="0x9208" instr="sub sp, #12"/>
      <inst addr="0x920a" instr="movs r3, #0"/>
      <inst addr="0x920c" instr="add r4, pc"/>
      <inst addr="0x920e" instr="ldr r4, [r4, #0]"/>
      <inst addr="0x9210" instr="ldr r4, [r5, r4]"/>
      <inst addr="0x9212" instr="str r4, [sp, #0]"/>
      <inst addr="0x9214" instr="bl 9220 ____strtol_l_internal"/>
      <succ>
        <link type="nottaken" cfg="36" bb="372"/>
        <link type="call" cfg="37" bb="373"/>
      </succ>
    </bb>
    <bb id="372">
      <inst addr="0x9218" instr="add sp, #12"/>
      <inst addr="0x921a" instr="pop {r4, r5, pc}"/>
      <inst addr="0x921c" instr=".word 0x0005da38"/>
      <succ>
      </succ>
    </bb>
  </cfg>
  <cfg id="37" name="____strtol_l_internal">
    <bb id="373">
      <inst addr="0x9220" instr="stmdb sp!, {r4, r5, r6, r7, r8, r9, sl, fp, lr}"/>
      <inst addr="0x9224" instr="sub sp, #44 ; 0x2c"/>
      <inst addr="0x9226" instr="ldr r5, [sp, #80] ; 0x50"/>
      <inst addr="0x9228" instr="str r1, [sp, #20]"/>
      <inst addr="0x922a" instr="str r0, [sp, #16]"/>
      <inst addr="0x922c" instr="ldr r1, [r5, #4]"/>
      <inst addr="0x922e" instr="cmp r3, #0"/>
      <inst addr="0x9230" instr="bne.w 9496 ____strtol_l_internal+0x276"/>
      <succ>
        <link type="nottaken" cfg="37" bb="374"/>
      </succ>
    </bb>
    <bb id="374">
      <inst addr="0x9234" instr="str r3, [sp, #12]"/>
      <succ>
        <link type="nottaken" cfg="37" bb="375"/>
      </succ>
    </bb>
    <bb id="375">
      <inst addr="0x9236" instr="sub.w ip, r2, #1"/>
      <inst addr="0x923a" instr="rsbs r1, ip, #0"/>
      <inst addr="0x923e" instr="adc.w r1, r1, ip"/>
      <inst addr="0x9242" instr="orrs.w r1, r1, r2, lsr #31"/>
      <inst addr="0x9246" instr="bne.n 9338 ____strtol_l_internal+0x118"/>
      <succ>
        <link type="taken" cfg="37" bb="397"/>
        <link type="nottaken" cfg="37" bb="376"/>
      </succ>
    </bb>
    <bb id="376">
      <inst addr="0x9248" instr="cmp r2, #36 ; 0x24"/>
      <inst addr="0x924a" instr="bgt.n 9338 ____strtol_l_internal+0x118"/>
      <succ>
        <link type="taken" cfg="37" bb="397"/>
        <link type="nottaken" cfg="37" bb="377"/>
      </succ>
    </bb>
    <bb id="377">
      <inst addr="0x924c" instr="ldr r0, [sp, #16]"/>
      <inst addr="0x924e" instr="ldr r7, [r5, #52] ; 0x34"/>
      <inst addr="0x9250" instr="ldrb r1, [r0, #0]"/>
      <inst addr="0x9252" instr="ldrh.w r0, [r7, r1, lsl #1]"/>
      <inst addr="0x9256" instr="lsls r0, r0, #18"/>
      <inst addr="0x9258" instr="it pl"/>
      <inst addr="0x925a" instr="ldrpl.w fp, [sp, #16]"/>
      <inst addr="0x925e" instr="bpl.n 9276 ____strtol_l_internal+0x56"/>
      <inst addr="0x9260" instr="ldr r0, [sp, #16]"/>
      <inst addr="0x9262" instr="mov fp, r0"/>
      <succ>
        <link type="nottaken" cfg="37" bb="378"/>
      </succ>
    </bb>
    <bb id="378">
      <inst addr="0x9264" instr="ldrb.w r1, [r0, #1]!"/>
      <inst addr="0x9268" instr="add.w fp, fp, #1"/>
      <inst addr="0x926c" instr="ldrh.w r4, [r7, r1, lsl #1]"/>
      <inst addr="0x9270" instr="tst.w r4, #8192 ; 0x2000"/>
      <inst addr="0x9274" instr="bne.n 9264 ____strtol_l_internal+0x44"/>
      <succ>
        <link type="taken" cfg="37" bb="378"/>
        <link type="nottaken" cfg="37" bb="379"/>
      </succ>
    </bb>
    <bb id="379">
      <inst addr="0x9276" instr="cmp r1, #0"/>
      <inst addr="0x9278" instr="beq.w 94b2 ____strtol_l_internal+0x292"/>
      <inst addr="0x927c" instr="cmp r1, #45 ; 0x2d"/>
      <inst addr="0x927e" instr="beq.w 9426 ____strtol_l_internal+0x206"/>
      <inst addr="0x9282" instr="cmp r1, #43 ; 0x2b"/>
      <inst addr="0x9284" instr="beq.n 935c ____strtol_l_internal+0x13c"/>
      <succ>
        <link type="taken" cfg="37" bb="401"/>
        <link type="nottaken" cfg="37" bb="380"/>
      </succ>
    </bb>
    <bb id="380">
      <inst addr="0x9286" instr="movs r1, #0"/>
      <inst addr="0x9288" instr="str r1, [sp, #28]"/>
      <succ>
        <link type="nottaken" cfg="37" bb="381"/>
      </succ>
    </bb>
    <bb id="381">
      <inst addr="0x928a" instr="ldrb.w r6, [fp]"/>
      <inst addr="0x928e" instr="cmp r6, #48 ; 0x30"/>
      <inst addr="0x9290" instr="beq.w 93f4 ____strtol_l_internal+0x1d4"/>
      <inst addr="0x9294" instr="cmp r2, #0"/>
      <inst addr="0x9296" instr="beq.n 934c ____strtol_l_internal+0x12c"/>
      <succ>
        <link type="taken" cfg="37" bb="400"/>
        <link type="nottaken" cfg="37" bb="382"/>
      </succ>
    </bb>
    <bb id="382">
      <inst addr="0x9298" instr="subs r0, r2, #2"/>
      <inst addr="0x929a" instr="cmp r2, #10"/>
      <inst addr="0x929c" instr="beq.n 934c ____strtol_l_internal+0x12c"/>
      <succ>
        <link type="taken" cfg="37" bb="400"/>
        <link type="nottaken" cfg="37" bb="383"/>
      </succ>
    </bb>
    <bb id="383">
      <inst addr="0x929e" instr="movs r4, #0"/>
      <inst addr="0x92a0" instr="mov ip, r4"/>
      <succ>
        <link type="nottaken" cfg="37" bb="384"/>
      </succ>
    </bb>
    <bb id="384">
      <inst addr="0x92a2" instr="ldr r3, [pc, #624] ; (9514 ____strtol_l_internal+0x2f4)"/>
      <inst addr="0x92a4" instr="adds r1, r3, r0"/>
      <inst addr="0x92a6" instr="ldr.w sl, [r3, r0, lsl #2]"/>
      <inst addr="0x92aa" instr="ldrb.w r1, [r1, #140] ; 0x8c"/>
      <inst addr="0x92ae" instr="str r1, [sp, #24]"/>
      <inst addr="0x92b0" instr="cmp r6, #0"/>
      <inst addr="0x92b2" instr="beq.n 939c ____strtol_l_internal+0x17c"/>
      <succ>
        <link type="taken" cfg="37" bb="408"/>
        <link type="nottaken" cfg="37" bb="385"/>
      </succ>
    </bb>
    <bb id="385">
      <inst addr="0x92b4" instr="cmp ip, fp"/>
      <inst addr="0x92b6" instr="beq.w 9454 ____strtol_l_internal+0x234"/>
      <inst addr="0x92ba" instr="movs r3, #0"/>
      <inst addr="0x92bc" instr="mov r0, fp"/>
      <inst addr="0x92be" instr="str.w fp, [sp, #36] ; 0x24"/>
      <inst addr="0x92c2" instr="mov fp, ip"/>
      <inst addr="0x92c4" instr="mov r9, r3"/>
      <inst addr="0x92c6" instr="subs r1, r4, #1"/>
      <inst addr="0x92c8" instr="str r3, [sp, #8]"/>
      <inst addr="0x92ca" instr="str r1, [sp, #32]"/>
      <succ>
        <link type="nottaken" cfg="37" bb="386"/>
      </succ>
    </bb>
    <bb id="386">
      <inst addr="0x92cc" instr="sub.w r3, r6, #48 ; 0x30"/>
      <inst addr="0x92d0" instr="uxtb r3, r3"/>
      <inst addr="0x92d2" instr="cmp r3, #9"/>
      <inst addr="0x92d4" instr="bls.n 937c ____strtol_l_internal+0x15c"/>
      <succ>
        <link type="taken" cfg="37" bb="404"/>
        <link type="nottaken" cfg="37" bb="387"/>
      </succ>
    </bb>
    <bb id="387">
      <inst addr="0x92d6" instr="cmp r4, #0"/>
      <inst addr="0x92d8" instr="beq.n 9368 ____strtol_l_internal+0x148"/>
      <succ>
        <link type="taken" cfg="37" bb="403"/>
        <link type="nottaken" cfg="37" bb="388"/>
      </succ>
    </bb>
    <bb id="388">
      <inst addr="0x92da" instr="ldr r3, [sp, #12]"/>
      <inst addr="0x92dc" instr="ldrb r1, [r3, #0]"/>
      <inst addr="0x92de" instr="ldrb r3, [r0, #0]"/>
      <inst addr="0x92e0" instr="cmp r1, r3"/>
      <inst addr="0x92e2" instr="bne.n 9368 ____strtol_l_internal+0x148"/>
      <succ>
        <link type="taken" cfg="37" bb="403"/>
        <link type="nottaken" cfg="37" bb="389"/>
      </succ>
    </bb>
    <bb id="389">
      <inst addr="0x92e4" instr="ldr r7, [sp, #12]"/>
      <inst addr="0x92e6" instr="mov r1, r0"/>
      <inst addr="0x92e8" instr="movs r3, #0"/>
      <inst addr="0x92ea" instr="mov r8, r6"/>
      <inst addr="0x92ec" instr="b.n 92fa ____strtol_l_internal+0xda"/>
      <succ>
        <link type="taken" cfg="37" bb="391"/>
      </succ>
    </bb>
    <bb id="390">
      <inst addr="0x92ee" instr="ldrb.w ip, [r7, #1]!"/>
      <inst addr="0x92f2" instr="ldrb.w r6, [r1, #1]!"/>
      <inst addr="0x92f6" instr="cmp ip, r6"/>
      <inst addr="0x92f8" instr="bne.n 9366 ____strtol_l_internal+0x146"/>
      <succ>
        <link type="taken" cfg="37" bb="402"/>
        <link type="nottaken" cfg="37" bb="391"/>
      </succ>
    </bb>
    <bb id="391">
      <inst addr="0x92fa" instr="adds r3, #1"/>
      <inst addr="0x92fc" instr="cmp r3, r4"/>
      <inst addr="0x92fe" instr="bne.n 92ee ____strtol_l_internal+0xce"/>
      <succ>
        <link type="taken" cfg="37" bb="390"/>
        <link type="nottaken" cfg="37" bb="392"/>
      </succ>
    </bb>
    <bb id="392">
      <inst addr="0x9300" instr="ldr r1, [sp, #32]"/>
      <inst addr="0x9302" instr="adds r0, r0, r1"/>
      <succ>
        <link type="nottaken" cfg="37" bb="393"/>
      </succ>
    </bb>
    <bb id="393">
      <inst addr="0x9304" instr="ldrb r6, [r0, #1]"/>
      <inst addr="0x9306" instr="adds r0, #1"/>
      <inst addr="0x9308" instr="cmp r6, #0"/>
      <inst addr="0x930a" instr="beq.n 9394 ____strtol_l_internal+0x174"/>
      <succ>
        <link type="taken" cfg="37" bb="407"/>
        <link type="nottaken" cfg="37" bb="394"/>
      </succ>
    </bb>
    <bb id="394">
      <inst addr="0x930c" instr="cmp fp, r0"/>
      <inst addr="0x930e" instr="bne.n 92cc ____strtol_l_internal+0xac"/>
      <succ>
        <link type="taken" cfg="37" bb="386"/>
        <link type="nottaken" cfg="37" bb="395"/>
      </succ>
    </bb>
    <bb id="395">
      <inst addr="0x9310" instr="ldr r2, [sp, #20]"/>
      <inst addr="0x9312" instr="cbz r2, 9316 ____strtol_l_internal+0xf6"/>
      <inst addr="0x9314" instr="str r0, [r2, #0]"/>
      <inst addr="0x9316" instr="ldr r3, [sp, #8]"/>
      <inst addr="0x9318" instr="cmp r3, #0"/>
      <inst addr="0x931a" instr="bne.n 93dc ____strtol_l_internal+0x1bc"/>
      <succ>
        <link type="taken" cfg="37" bb="414"/>
        <link type="nottaken" cfg="37" bb="396"/>
      </succ>
    </bb>
    <bb id="396">
      <inst addr="0x931c" instr="ldr r0, [sp, #28]"/>
      <inst addr="0x931e" instr="cmp r0, #0"/>
      <inst addr="0x9320" instr="ite eq"/>
      <inst addr="0x9322" instr="mvneq.w r3, #2147483648 ; 0x80000000"/>
      <inst addr="0x9326" instr="movne.w r3, #2147483648 ; 0x80000000"/>
      <inst addr="0x932a" instr="cmp r3, r9"/>
      <inst addr="0x932c" instr="bcc.n 93dc ____strtol_l_internal+0x1bc"/>
      <inst addr="0x932e" instr="ldr r0, [sp, #28]"/>
      <inst addr="0x9330" instr="cbz r0, 9344 ____strtol_l_internal+0x124"/>
      <inst addr="0x9332" instr="rsb r9, r9, #0"/>
      <inst addr="0x9336" instr="b.n 9344 ____strtol_l_internal+0x124"/>
      <succ>
        <link type="taken" cfg="37" bb="399"/>
      </succ>
    </bb>
    <bb id="397">
      <inst addr="0x9338" instr="bl 8e30 __errno_location"/>
      <succ>
        <link type="nottaken" cfg="37" bb="398"/>
        <link type="call" cfg="26" bb="264"/>
      </succ>
    </bb>
    <bb id="398">
      <inst addr="0x933c" instr="mov.w r9, #0"/>
      <inst addr="0x9340" instr="movs r3, #22"/>
      <inst addr="0x9342" instr="str r3, [r0, #0]"/>
      <succ>
        <link type="nottaken" cfg="37" bb="399"/>
      </succ>
    </bb>
    <bb id="399">
      <inst addr="0x9344" instr="mov r0, r9"/>
      <inst addr="0x9346" instr="add sp, #44 ; 0x2c"/>
      <inst addr="0x9348" instr="ldmia.w sp!, {r4, r5, r6, r7, r8, r9, sl, fp, pc}"/>
      <succ>
        <link type="nottaken" cfg="37" bb="400"/>
      </succ>
    </bb>
    <bb id="400">
      <inst addr="0x934c" instr="cmp r3, #0"/>
      <inst addr="0x934e" instr="bne.w 9458 ____strtol_l_internal+0x238"/>
      <inst addr="0x9352" instr="mov r4, r3"/>
      <inst addr="0x9354" instr="movs r0, #8"/>
      <inst addr="0x9356" instr="movs r2, #10"/>
      <inst addr="0x9358" instr="mov ip, r3"/>
      <inst addr="0x935a" instr="b.n 92a2 ____strtol_l_internal+0x82"/>
      <succ>
        <link type="taken" cfg="37" bb="384"/>
      </succ>
    </bb>
    <bb id="401">
      <inst addr="0x935c" instr="movs r0, #0"/>
      <inst addr="0x935e" instr="add.w fp, fp, #1"/>
      <inst addr="0x9362" instr="str r0, [sp, #28]"/>
      <inst addr="0x9364" instr="b.n 928a ____strtol_l_internal+0x6a"/>
      <succ>
        <link type="taken" cfg="37" bb="381"/>
      </succ>
    </bb>
    <bb id="402">
      <inst addr="0x9366" instr="mov r6, r8"/>
      <succ>
        <link type="nottaken" cfg="37" bb="403"/>
      </succ>
    </bb>
    <bb id="403">
      <inst addr="0x9368" instr="ldr r3, [r5, #52] ; 0x34"/>
      <inst addr="0x936a" instr="ldrh.w r3, [r3, r6, lsl #1]"/>
      <inst addr="0x936e" instr="lsls r3, r3, #21"/>
      <inst addr="0x9370" instr="bpl.n 9394 ____strtol_l_internal+0x174"/>
      <inst addr="0x9372" instr="ldr r3, [r5, #60] ; 0x3c"/>
      <inst addr="0x9374" instr="ldr.w r3, [r3, r6, lsl #2]"/>
      <inst addr="0x9378" instr="subs r3, #55 ; 0x37"/>
      <inst addr="0x937a" instr="uxtb r3, r3"/>
      <succ>
        <link type="nottaken" cfg="37" bb="404"/>
      </succ>
    </bb>
    <bb id="404">
      <inst addr="0x937c" instr="cmp r2, r3"/>
      <inst addr="0x937e" instr="ble.n 9394 ____strtol_l_internal+0x174"/>
      <succ>
        <link type="taken" cfg="37" bb="407"/>
        <link type="nottaken" cfg="37" bb="405"/>
      </succ>
    </bb>
    <bb id="405">
      <inst addr="0x9380" instr="cmp sl, r9"/>
      <inst addr="0x9382" instr="bcc.n 93d6 ____strtol_l_internal+0x1b6"/>
      <inst addr="0x9384" instr="cmp r9, sl"/>
      <inst addr="0x9386" instr="beq.n 93ca ____strtol_l_internal+0x1aa"/>
      <succ>
        <link type="taken" cfg="37" bb="412"/>
        <link type="nottaken" cfg="37" bb="406"/>
      </succ>
    </bb>
    <bb id="406">
      <inst addr="0x9388" instr="ldrb r6, [r0, #1]"/>
      <inst addr="0x938a" instr="adds r0, #1"/>
      <inst addr="0x938c" instr="mla r9, r2, r9, r3"/>
      <inst addr="0x9390" instr="cmp r6, #0"/>
      <inst addr="0x9392" instr="bne.n 930c ____strtol_l_internal+0xec"/>
      <succ>
        <link type="taken" cfg="37" bb="394"/>
        <link type="nottaken" cfg="37" bb="407"/>
      </succ>
    </bb>
    <bb id="407">
      <inst addr="0x9394" instr="ldr.w fp, [sp, #36] ; 0x24"/>
      <inst addr="0x9398" instr="cmp fp, r0"/>
      <inst addr="0x939a" instr="bne.n 9310 ____strtol_l_internal+0xf0"/>
      <succ>
        <link type="taken" cfg="37" bb="395"/>
        <link type="nottaken" cfg="37" bb="408"/>
      </succ>
    </bb>
    <bb id="408">
      <inst addr="0x939c" instr="ldr r2, [sp, #20]"/>
      <inst addr="0x939e" instr="ldr.w r9, [sp, #20]"/>
      <inst addr="0x93a2" instr="cmp r2, #0"/>
      <inst addr="0x93a4" instr="beq.n 9344 ____strtol_l_internal+0x124"/>
      <succ>
        <link type="taken" cfg="37" bb="399"/>
        <link type="nottaken" cfg="37" bb="409"/>
      </succ>
    </bb>
    <bb id="409">
      <inst addr="0x93a6" instr="ldr r0, [sp, #16]"/>
      <inst addr="0x93a8" instr="rsb r3, r0, fp"/>
      <inst addr="0x93ac" instr="cmp r3, #1"/>
      <inst addr="0x93ae" instr="ble.n 93be ____strtol_l_internal+0x19e"/>
      <succ>
        <link type="taken" cfg="37" bb="411"/>
        <link type="nottaken" cfg="37" bb="410"/>
      </succ>
    </bb>
    <bb id="410">
      <inst addr="0x93b0" instr="ldrb.w r2, [fp, #-1]"/>
      <inst addr="0x93b4" instr="ldr r3, [r5, #60] ; 0x3c"/>
      <inst addr="0x93b6" instr="ldr.w r3, [r3, r2, lsl #2]"/>
      <inst addr="0x93ba" instr="cmp r3, #88 ; 0x58"/>
      <inst addr="0x93bc" instr="beq.n 943e ____strtol_l_internal+0x21e"/>
      <succ>
        <link type="taken" cfg="37" bb="420"/>
        <link type="nottaken" cfg="37" bb="411"/>
      </succ>
    </bb>
    <bb id="411">
      <inst addr="0x93be" instr="ldr r2, [sp, #16]"/>
      <inst addr="0x93c0" instr="mov.w r9, #0"/>
      <inst addr="0x93c4" instr="ldr r3, [sp, #20]"/>
      <inst addr="0x93c6" instr="str r2, [r3, #0]"/>
      <inst addr="0x93c8" instr="b.n 9344 ____strtol_l_internal+0x124"/>
      <succ>
        <link type="taken" cfg="37" bb="399"/>
      </succ>
    </bb>
    <bb id="412">
      <inst addr="0x93ca" instr="ldr r1, [sp, #24]"/>
      <inst addr="0x93cc" instr="cmp r1, r3"/>
      <inst addr="0x93ce" instr="bcs.n 9388 ____strtol_l_internal+0x168"/>
      <inst addr="0x93d0" instr="movs r1, #1"/>
      <inst addr="0x93d2" instr="str r1, [sp, #8]"/>
      <inst addr="0x93d4" instr="b.n 9304 ____strtol_l_internal+0xe4"/>
      <succ>
        <link type="taken" cfg="37" bb="393"/>
      </succ>
    </bb>
    <bb id="414">
      <inst addr="0x93dc" instr="bl 8e30 __errno_location"/>
      <succ>
        <link type="nottaken" cfg="37" bb="415"/>
        <link type="call" cfg="26" bb="264"/>
      </succ>
    </bb>
    <bb id="415">
      <inst addr="0x93e0" instr="ldr r1, [sp, #28]"/>
      <inst addr="0x93e2" instr="cmp r1, #0"/>
      <inst addr="0x93e4" instr="ite eq"/>
      <inst addr="0x93e6" instr="mvneq.w r9, #2147483648 ; 0x80000000"/>
      <inst addr="0x93ea" instr="movne.w r9, #2147483648 ; 0x80000000"/>
      <inst addr="0x93ee" instr="movs r3, #34 ; 0x22"/>
      <inst addr="0x93f0" instr="str r3, [r0, #0]"/>
      <inst addr="0x93f2" instr="b.n 9344 ____strtol_l_internal+0x124"/>
      <succ>
        <link type="taken" cfg="37" bb="399"/>
      </succ>
    </bb>
    <bb id="420">
      <inst addr="0x943e" instr="ldrb.w r3, [fp, #-2]"/>
      <inst addr="0x9442" instr="cmp r3, #48 ; 0x30"/>
      <inst addr="0x9444" instr="bne.n 93be ____strtol_l_internal+0x19e"/>
      <succ>
        <link type="taken" cfg="37" bb="411"/>
        <link type="nottaken" cfg="37" bb="421"/>
      </succ>
    </bb>
    <bb id="421">
      <inst addr="0x9446" instr="ldr r1, [sp, #20]"/>
      <inst addr="0x9448" instr="add.w r3, fp, #4294967295 ; 0xffffffff"/>
      <inst addr="0x944c" instr="mov.w r9, #0"/>
      <inst addr="0x9450" instr="str r3, [r1, #0]"/>
      <inst addr="0x9452" instr="b.n 9344 ____strtol_l_internal+0x124"/>
      <succ>
        <link type="taken" cfg="37" bb="399"/>
      </succ>
    </bb>
    <bb id="1">
      <succ>
      </succ>
    </bb>
  </cfg>
  <cfg id="39" name="__correctly_grouped_prefixmb">
    <bb id="446">
      <inst addr="0x953c" instr="stmdb sp!, {r4, r5, r6, r7, r8, r9, sl, fp, lr}"/>
      <inst addr="0x9540" instr="sub sp, #20"/>
      <inst addr="0x9542" instr="mov r4, r0"/>
      <inst addr="0x9544" instr="mov r5, r2"/>
      <inst addr="0x9546" instr="str r1, [sp, #0]"/>
      <inst addr="0x9548" instr="str r3, [sp, #8]"/>
      <inst addr="0x954a" instr="cmp r3, #0"/>
      <inst addr="0x954c" instr="beq.n 95ce __correctly_grouped_prefixmb+0x92"/>
      <succ>
        <link type="taken" cfg="39" bb="461"/>
        <link type="nottaken" cfg="39" bb="447"/>
      </succ>
    </bb>
    <bb id="447">
      <inst addr="0x954e" instr="mov r0, r2"/>
      <inst addr="0x9550" instr="blx fa20 strlen"/>
      <inst addr="0x9554" instr="ldr r1, [sp, #0]"/>
      <inst addr="0x9556" instr="cmp r1, r4"/>
      <inst addr="0x9558" instr="bls.n 95c4 __correctly_grouped_prefixmb+0x88"/>
      <succ>
        <link type="taken" cfg="39" bb="460"/>
        <link type="nottaken" cfg="39" bb="448"/>
      </succ>
    </bb>
    <bb id="448">
      <inst addr="0x955a" instr="mov r8, r4"/>
      <inst addr="0x955c" instr="add.w r9, r0, #4294967295 ; 0xffffffff"/>
      <inst addr="0x9560" instr="subs r0, #2"/>
      <inst addr="0x9562" instr="str r0, [sp, #12]"/>
      <inst addr="0x9564" instr="ldr r1, [sp, #0]"/>
      <inst addr="0x9566" instr="subs r6, r1, #1"/>
      <inst addr="0x9568" instr="cmp r8, r6"/>
      <inst addr="0x956a" instr="bhi.n 95ce __correctly_grouped_prefixmb+0x92"/>
      <succ>
        <link type="taken" cfg="39" bb="461"/>
        <link type="nottaken" cfg="39" bb="449"/>
      </succ>
    </bb>
    <bb id="449">
      <inst addr="0x956c" instr="ldr r2, [sp, #12]"/>
      <inst addr="0x956e" instr="ldrb r4, [r5, #0]"/>
      <inst addr="0x9570" instr="adds r7, r1, r2"/>
      <inst addr="0x9572" instr="b.n 957a __correctly_grouped_prefixmb+0x3e"/>
      <succ>
        <link type="taken" cfg="39" bb="451"/>
      </succ>
    </bb>
    <bb id="450">
      <inst addr="0x9574" instr="subs r6, #1"/>
      <inst addr="0x9576" instr="cmp r8, r6"/>
      <inst addr="0x9578" instr="bhi.n 95ce __correctly_grouped_prefixmb+0x92"/>
      <succ>
        <link type="taken" cfg="39" bb="461"/>
        <link type="nottaken" cfg="39" bb="451"/>
      </succ>
    </bb>
    <bb id="451">
      <inst addr="0x957a" instr="ldrb.w r3, [r7], #-1"/>
      <inst addr="0x957e" instr="cmp r4, r3"/>
      <inst addr="0x9580" instr="bne.n 9574 __correctly_grouped_prefixmb+0x38"/>
      <succ>
        <link type="taken" cfg="39" bb="450"/>
        <link type="nottaken" cfg="39" bb="452"/>
      </succ>
    </bb>
    <bb id="452">
      <inst addr="0x9582" instr="ldrb r3, [r5, #1]"/>
      <inst addr="0x9584" instr="cbz r3, 95a2 __correctly_grouped_prefixmb+0x66"/>
      <inst addr="0x9586" instr="ldrb r2, [r7, #0]"/>
      <inst addr="0x9588" instr="cmp r2, r3"/>
      <inst addr="0x958a" instr="bne.n 9574 __correctly_grouped_prefixmb+0x38"/>
      <succ>
        <link type="taken" cfg="39" bb="450"/>
        <link type="nottaken" cfg="39" bb="453"/>
      </succ>
    </bb>
    <bb id="453">
      <inst addr="0x958c" instr="adds r2, r5, #1"/>
      <inst addr="0x958e" instr="mov r1, r7"/>
      <inst addr="0x9590" instr="b.n 959a __correctly_grouped_prefixmb+0x5e"/>
      <succ>
        <link type="taken" cfg="39" bb="455"/>
      </succ>
    </bb>
    <bb id="454">
      <inst addr="0x9592" instr="ldrb.w r0, [r1, #-1]!"/>
      <inst addr="0x9596" instr="cmp r0, r3"/>
      <inst addr="0x9598" instr="bne.n 9574 __correctly_grouped_prefixmb+0x38"/>
      <succ>
        <link type="taken" cfg="39" bb="450"/>
        <link type="nottaken" cfg="39" bb="455"/>
      </succ>
    </bb>
    <bb id="455">
      <inst addr="0x959a" instr="ldrb.w r3, [r2, #1]!"/>
      <inst addr="0x959e" instr="cmp r3, #0"/>
      <inst addr="0x95a0" instr="bne.n 9592 __correctly_grouped_prefixmb+0x56"/>
      <succ>
        <link type="taken" cfg="39" bb="454"/>
        <link type="nottaken" cfg="39" bb="456"/>
      </succ>
    </bb>
    <bb id="456">
      <inst addr="0x95a2" instr="cmp r8, r6"/>
      <inst addr="0x95a4" instr="str r6, [sp, #4]"/>
      <inst addr="0x95a6" instr="bhi.n 95ce __correctly_grouped_prefixmb+0x92"/>
      <succ>
        <link type="taken" cfg="39" bb="461"/>
        <link type="nottaken" cfg="39" bb="457"/>
      </succ>
    </bb>
    <bb id="457">
      <inst addr="0x95a8" instr="ldr r1, [sp, #8]"/>
      <inst addr="0x95aa" instr="ldrb r3, [r1, #0]"/>
      <inst addr="0x95ac" instr="ldr r1, [sp, #0]"/>
      <inst addr="0x95ae" instr="adds r3, #1"/>
      <inst addr="0x95b0" instr="subs r2, r1, r6"/>
      <inst addr="0x95b2" instr="cmp r2, r3"/>
      <inst addr="0x95b4" instr="beq.n 95d6 __correctly_grouped_prefixmb+0x9a"/>
      <succ>
        <link type="taken" cfg="39" bb="462"/>
        <link type="nottaken" cfg="39" bb="458"/>
      </succ>
    </bb>
    <bb id="458">
      <inst addr="0x95b6" instr="it gt"/>
      <inst addr="0x95b8" instr="addgt r6, r6, r3"/>
      <inst addr="0x95ba" instr="str r6, [sp, #0]"/>
      <succ>
        <link type="nottaken" cfg="39" bb="459"/>
      </succ>
    </bb>
    <bb id="459">
      <inst addr="0x95bc" instr="ldr r1, [sp, #0]"/>
      <inst addr="0x95be" instr="cmp r8, r1"/>
      <inst addr="0x95c0" instr="bcc.n 9564 __correctly_grouped_prefixmb+0x28"/>
      <inst addr="0x95c2" instr="mov r4, r8"/>
      <succ>
        <link type="nottaken" cfg="39" bb="460"/>
      </succ>
    </bb>
    <bb id="460">
      <inst addr="0x95c4" instr="ldr r1, [sp, #0]"/>
      <inst addr="0x95c6" instr="cmp r1, r4"/>
      <inst addr="0x95c8" instr="it cc"/>
      <inst addr="0x95ca" instr="movcc r1, r4"/>
      <inst addr="0x95cc" instr="str r1, [sp, #0]"/>
      <succ>
        <link type="nottaken" cfg="39" bb="461"/>
      </succ>
    </bb>